{
  "schema_version": "1.6.1",
  "id": "ECHO-go-0001",
  "modified": "2026-09-30T09:00:00Z",
  "published": "2026-09-30T09:00:00Z",
  "aliases": [
    "CVE-2026-46600"
  ],
  "summary": "golang.org/x/net vulnerability",
  "details": "The golang.org/x/net module before v0.55.0+echo.1 is vulnerable.",
  "affected": [
    {
      "package": {
        "ecosystem": "Echo:Go",
        "name": "golang.org/x/net",
        "purl": "pkg:golang/golang.org/x/net"
      },
      "ranges": [
        {
          "type": "ECOSYSTEM",
          "events": [
            {
              "introduced": "0"
            },
            {
              "fixed": "v0.55.0+echo.1"
            }
          ]
        }
      ]
    }
  ],
  "references": [
    {
      "type": "ADVISORY",
      "url": "https://nvd.nist.gov/vuln/detail/CVE-2026-46600"
    }
  ],
  "severity": [
    {
      "type": "CVSS_V3",
      "score": "CVSS:3.1/AV:N/AC:L/PR:N/UI:N/S:U/C:H/I:H/A:H"
    }
  ],
  "database_specific": {
    "source": "Echo",
    "anchore": {
      "record_type": "advisory"
    }
  }
}
