{
  "affected": [
    {
      "ecosystem_specific": {
        "availability": "No subscription required",
        "binaries": [
          {
            "binary_name": "a2ps",
            "binary_version": "1:4.14-1.2"
          }
        ]
      },
      "package": {
        "ecosystem": "Ubuntu:14.04:LTS",
        "name": "a2ps",
        "purl": "pkg:deb/ubuntu/a2ps@1:4.14-1.2?arch=source&distro=trusty"
      },
      "ranges": [
        {
          "database_specific": {
            "anchore": {
              "fixes": [
                {
                  "date": "2014-04-05",
                  "kind": "advisory",
                  "version": "1:4.14-1.2"
                }
              ]
            }
          },
          "events": [
            {
              "introduced": "0"
            },
            {
              "fixed": "1:4.14-1.2"
            }
          ],
          "type": "ECOSYSTEM"
        }
      ],
      "versions": [
        "1:4.14-1.1"
      ]
    }
  ],
  "aliases": [],
  "details": "Jakub Wilk found that a2ps, a tool to convert text and other types of files to PostScript, insecurely used a temporary file in spy_user(). A local attacker could use this flaw to perform a symbolic link attack to modify an arbitrary file accessible to the user running a2ps.",
  "id": "UBUNTU-CVE-2001-1593",
  "modified": "2025-07-16T04:49:52Z",
  "published": "2014-04-05T21:55:00Z",
  "references": [
    {
      "type": "REPORT",
      "url": "https://ubuntu.com/security/CVE-2001-1593"
    },
    {
      "type": "REPORT",
      "url": "https://www.cve.org/CVERecord?id=CVE-2001-1593"
    }
  ],
  "related": [],
  "schema_version": "1.7.0",
  "severity": [
    {
      "score": "low",
      "type": "Ubuntu"
    }
  ],
  "upstream": [
    "CVE-2001-1593"
  ],
  "withdrawn": "2025-07-18T16:42:37Z"
}