{
  "schema_version": "1.6.1",
  "id": "ROOT-APP-PYPI-CVE-2025-30473",
  "modified": "2024-12-15T14:30:00Z",
  "published": "2024-12-10T09:00:00Z",
  "aliases": [
    "CVE-2025-30473"
  ],
  "summary": "requests vulnerable to improper certificate validation",
  "details": "The requests library before version 2.31.0+root.io.1 contains a vulnerability in certificate validation that may allow man-in-the-middle attacks.",
  "affected": [
    {
      "package": {
        "ecosystem": "Root:PyPI",
        "name": "rootio_requests"
      },
      "ranges": [
        {
          "type": "ECOSYSTEM",
          "events": [
            {
              "introduced": "0"
            },
            {
              "fixed": "2.31.0+root.io.1"
            }
          ]
        }
      ]
    }
  ],
  "references": [
    {
      "type": "ADVISORY",
      "url": "https://nvd.nist.gov/vuln/detail/CVE-2025-30473"
    }
  ],
  "severity": [
    {
      "type": "CVSS_V3",
      "score": "CVSS:3.1/AV:N/AC:H/PR:N/UI:N/S:U/C:H/I:H/A:N"
    }
  ],
  "database_specific": {
    "source": "Root",
    "anchore": {
      "record_type": "advisory"
    }
  }
}
