{
  "affected": [
    {
      "ecosystem_specific": {
        "availability": "No subscription required",
        "binaries": [
          {
            "binary_name": "curl",
            "binary_version": "7.81.0-1ubuntu1.14"
          },
          {
            "binary_name": "libcurl3-gnutls",
            "binary_version": "7.81.0-1ubuntu1.14"
          },
          {
            "binary_name": "libcurl3-nss",
            "binary_version": "7.81.0-1ubuntu1.14"
          },
          {
            "binary_name": "libcurl4",
            "binary_version": "7.81.0-1ubuntu1.14"
          }
        ],
        "priority_reason": "Upstream curl developer has rated this issue as high"
      },
      "package": {
        "ecosystem": "Ubuntu:22.04:LTS",
        "name": "curl",
        "purl": "pkg:deb/ubuntu/curl@7.81.0-1ubuntu1.14?arch=source&distro=jammy"
      },
      "ranges": [
        {
          "database_specific": {
            "anchore": {
              "fixes": [
                {
                  "date": "2023-10-11",
                  "kind": "advisory",
                  "version": "7.81.0-1ubuntu1.14"
                }
              ]
            }
          },
          "events": [
            {
              "introduced": "0"
            },
            {
              "fixed": "7.81.0-1ubuntu1.14"
            }
          ],
          "type": "ECOSYSTEM"
        }
      ],
      "versions": [
        "7.74.0-1.3ubuntu2",
        "7.74.0-1.3ubuntu3",
        "7.80.0-3",
        "7.81.0-1",
        "7.81.0-1ubuntu1.1",
        "7.81.0-1ubuntu1.2",
        "7.81.0-1ubuntu1.3",
        "7.81.0-1ubuntu1.4",
        "7.81.0-1ubuntu1.6",
        "7.81.0-1ubuntu1.7",
        "7.81.0-1ubuntu1.8",
        "7.81.0-1ubuntu1.10",
        "7.81.0-1ubuntu1.11",
        "7.81.0-1ubuntu1.13"
      ]
    },
    {
      "ecosystem_specific": {
        "availability": "No subscription required",
        "binaries": [
          {
            "binary_name": "curl",
            "binary_version": "8.2.1-1ubuntu3.1"
          },
          {
            "binary_name": "libcurl3-gnutls",
            "binary_version": "8.2.1-1ubuntu3.1"
          },
          {
            "binary_name": "libcurl3-nss",
            "binary_version": "8.2.1-1ubuntu3.1"
          },
          {
            "binary_name": "libcurl4",
            "binary_version": "8.2.1-1ubuntu3.1"
          }
        ],
        "priority_reason": "Upstream curl developer has rated this issue as high"
      },
      "package": {
        "ecosystem": "Ubuntu:24.04:LTS",
        "name": "curl",
        "purl": "pkg:deb/ubuntu/curl@8.2.1-1ubuntu3.1?arch=source&distro=noble"
      },
      "ranges": [
        {
          "database_specific": {
            "anchore": {
              "fixes": [
                {
                  "date": "2023-10-11",
                  "kind": "advisory",
                  "version": "8.2.1-1ubuntu3.1"
                }
              ]
            }
          },
          "events": [
            {
              "introduced": "0"
            },
            {
              "fixed": "8.2.1-1ubuntu3.1"
            }
          ],
          "type": "ECOSYSTEM"
        }
      ],
      "versions": [
        "8.2.1-1ubuntu3"
      ]
    }
  ],
  "aliases": [],
  "details": "This flaw makes curl overflow a heap based buffer in the SOCKS5 proxy handshake. When curl is asked to pass along the host name to the SOCKS5 proxy to allow that to resolve the address instead of it getting done by curl itself, the maximum length that host name can be is 255 bytes. If the host name is detected to be longer, curl switches to local name resolving and instead passes on the resolved address only. Due to this bug, the local variable that means \"let the host resolve the name\" could get the wrong value during a slow SOCKS5 handshake, and contrary to the intention, copy the too long host name to the target buffer instead of copying just the resolved address there. The target buffer being a heap based buffer, and the host name coming from the URL that curl has been told to operate with.",
  "id": "UBUNTU-CVE-2023-38545",
  "modified": "2026-04-22T07:45:24Z",
  "published": "2023-10-11T06:00:00Z",
  "references": [
    {
      "type": "REPORT",
      "url": "https://ubuntu.com/security/CVE-2023-38545"
    },
    {
      "type": "REPORT",
      "url": "https://curl.se/docs/CVE-2023-38545.html"
    },
    {
      "type": "ADVISORY",
      "url": "https://ubuntu.com/security/notices/USN-6429-1"
    },
    {
      "type": "ADVISORY",
      "url": "https://ubuntu.com/security/notices/USN-6429-3"
    },
    {
      "type": "REPORT",
      "url": "https://www.cve.org/CVERecord?id=CVE-2023-38545"
    }
  ],
  "related": [
    "USN-6429-1",
    "USN-6429-3"
  ],
  "schema_version": "1.7.0",
  "severity": [
    {
      "score": "CVSS:3.1/AV:N/AC:L/PR:N/UI:N/S:U/C:H/I:H/A:H",
      "type": "CVSS_V3"
    },
    {
      "score": "CVSS:3.1/AV:N/AC:L/PR:N/UI:R/S:U/C:H/I:H/A:H",
      "type": "CVSS_V3"
    },
    {
      "score": "high",
      "type": "Ubuntu"
    }
  ],
  "upstream": [
    "CVE-2023-38545"
  ]
}