{
  "schema_version": "1.6.1",
  "id": "ROOT-OS-ALPINE-318-CVE-2000-0548",
  "modified": "2024-11-20T16:00:00Z",
  "published": "2024-11-15T12:00:00Z",
  "aliases": [
    "CVE-2000-0548"
  ],
  "summary": "util-linux vulnerability in mount command",
  "details": "The mount command in util-linux before version 2.38.1-r10071 has a vulnerability that could allow local privilege escalation.",
  "affected": [
    {
      "package": {
        "ecosystem": "Alpine:3.18",
        "name": "rootio-util-linux"
      },
      "ranges": [
        {
          "type": "ECOSYSTEM",
          "events": [
            {
              "introduced": "0"
            },
            {
              "fixed": "2.38.1-r10071"
            }
          ]
        }
      ]
    }
  ],
  "references": [
    {
      "type": "ADVISORY",
      "url": "https://nvd.nist.gov/vuln/detail/CVE-2000-0548"
    },
    {
      "type": "WEB",
      "url": "https://security.alpinelinux.org/vuln/CVE-2000-0548"
    }
  ],
  "severity": [
    {
      "type": "CVSS_V3",
      "score": "CVSS:3.1/AV:L/AC:L/PR:L/UI:N/S:U/C:H/I:H/A:H"
    }
  ],
  "database_specific": {
    "source": "Root",
    "anchore": {
      "record_type": "advisory"
    }
  }
}
